"Product","Country","Ingredients","Price","Rev_score","Rev_count","Size","Brand"
"NYX Professional Makeup Stay Matte But Not Flat Foundation Powder, Natural","China","Nylon-12, Hydrogenated Polyisobutene, Magnesium Stearate, Silica, Phenyl Trimethicone, Bis-Diglyceryl Polyacyladipate-2, Cyclopentasiloxane, Dimethiconol, Zinc Stearate, Boron Nitride, Methylparaben, Propylparaben, Tocopheryl Acetate, May Contain (+/-), Mica, Titanium Dioxide (CI 77891), Iron Oxides (CI 77491, 77492, 77499)",7.49,4.3,432,0.26,"NYX"
"Milani Conceal + Perfect Shine-Proof Powder, Medium/Dark","United States","",NA,4.8,60,0.42,"Milani"
"Maybelline Fit Me Matte + Poreless Liquid Foundation, Cappuccino","","Water, Cyclohexasiloxane, Nylon-12, Isododecane, Alcohol Denat., Cyclopentasiloxane, PEG-10 Dimethicone, Cetyl PEG/PPG-10/1 Dimethicone, PEG-20, Polyglyceryl-4 Isostearate, Disteardimonium Hectorite, Phenoxyethanol, Magnesium Sulfate, Disodium Stearoyl Glutamate, HDI/Trimethylol Hexyllactone Crosspolymer, Titanium Dioxide, Methylparaben, Acrylates Copolymer, Tocopherol, Butylparaben, Aluminum Hydroxide, Alumina, Silica, Glycerin, May Contain (+/-): Titanium Dioxide, Iron Oxides",7.99,4.3,2088,1,"Maybelline"
"Maybelline Dream Urban Cover Full Coverage Foundation Makeup, SPF 50, Porcelain","United States","Homosalate - 10 % (Sunscreen), Octisalate - 5 % (Sunscreen), Octocrylene - 4 % (Sunscreen)",12.99,4.3,155,1,"Maybelline"
"Physicians Formula Super BB InstaReadyBeauty Balm Cream SPF 30, Light","","Titanium Dioxide 5.76%, Zinc Oxide 2.96%",15.99,NA,155,1.2,"Physicians"
"L'Oreal Paris Infallible Pro-Spray + Set Make-Up Setting Spray","","Aqua (Water), Alcohol Denat., PVP, Dimethicone PEG-7 Phosphate, Phenoxyethanol, Polyhydroxystearic Acid, Isononyl Isononanoate, PPG-3 Benzyl Ether Myristate, Poloxamer 407, Ethylhexyl Isononanoate, Sodium Benzoate, Sodium Cocamidopropyl PG-Dimonium Chloride Phosphate, Potassium Sorbate, Aloe Barbadensis (Aloe Barbadensis Leaf Juice), Limonene, Linalool, Fragrance",16.49,4.1,203,3.4,"L'Oreal"
"Rimmel Insta Flawless Color Correcting Primer, Green","Monaco","Dimethicone/Methicone Silsesquioxane Crosspolymer, Ethylhexyl Methoxycinnamate, Dimethicone Crosspolymer, Dimethicone/Peg-10/15 Crosspolymer, Magnesium Sulfate, Lauryl Peg-9 Polydimethylsiloxyethyl Dimethicone, Phenoxyethanol, Parfum/Fragrance, Caprylyl Glycol, Tocopheryl Acetate, Lecithin, Punica Granatum Fruit Juice, Vitis Vinifera (Grape) Juice, Ethylhexyl Palmitate, Glycerin, Retinyl Palmitate, Sorbic Acid, Silica, Hexyl Cinnamal, Limonene, Dipropylene Glycol, Butylphenyl Methylpropional, Ascorbyl Glucoside, Benzyl Salicylate, Linalool, Panthenol, Geraniol, Tocopherol, Citronellol, Alphaisomethyl Ionone, Silica Dimethyl Silylate, Bht, Butylene Glycol, Sapphire Powder, Palmaria Palmata Extract, Sodium Hyaluronate, Hexylene Glycol, Pantolactone, Mica, Chromium Oxide Greens (Ci 77288), Ultramarines (Ci 77007), Chromium Hydroxide Green (Ci 77289), Ferric Ferrocyanide (Ci 77510), Carmine (Ci 75470), May Contain/Peut Contenir/+/-:Titanium Dioxide (Ci 77891), Iron Oxides (Ci 77491), Ci (77492), Ci (77499)",7.99,4.3,3,1,"Rimmel"
"Milani Prime Perfection Face Primer","USA","Water (Aqua), Ethylhexyl Methoxycinnamate, Polymethylsilsesquioxane, Neopentyl Glycol Diheptanoate, Hydroxypropylcocoate Peg-8 Dimethicone, Isododecane, Dimethicone, Glycerin, Cyclopentasiloxane, Allantoin, Dimethicone/Vinyl Dimethicone Crosspolymer, Phenoxyethanol, Magnesium Sulfate, Peg/Ppg-18/18 Dimethicone, Silica, Zea Mays (Corn), Starch, Ethylhexylglycerin, Menthone Glycerin Acetal, Disodium Edta, Bht, Sodium Hydroxide, Sodium Hyaluronate",NA,4.4,21,0.68,"Milani"
"Revlon PhotoReady Candid Foundation, Light Honey","United States","Aqua/Water/Eau, Cyclopentasiloxane, Dimethicone, Phenyl Trimethicone, PEG-9 Polydimethylsiloxyethyl Dimethicone, Trimethylsiloxysilicate, Butylene Glycol, Polymethylsilsesquioxane, Polysilicone-11, HDI/Trimethylol Hexyllactone Crosspolymer, Aloe Barbadensis Leaf Extract, Aluminum Starch Octenylsuccinate, Camellia Sinensis Leaf Extract, Cucumis Sativus (Cucumber) Fruit Extract, Dimethicone/PEG-10/15 Crosspolymer, Disteardimonium Hectorite, Ethylene Brassylate, Laureth-7, Lecithin, Magnesium Sulfate, Maris Sal/Sea Salt/Sel Marin, Methicone, Mica, Polyglyceryl-3 Diisostearate, Pullulan, Sclerotium Gum, Silica, Sodium Ascorbyl Phosphate, Sodium Carrageenan, Tetrasodium EDTA, Tocopherol, Tocopheryl Acetate, Triethyl Citrate, Xanthan Gum, Caprylyl Glycol, Phenoxyethanol, May Contain: Iron Oxides (CI 77491, CI 77492, CI 77499), Titanium Dioxide (CI 77891)",10.99,4.3,519,0.75,"Revlon"
"IMAN Luxury Concealing Foundation, Sand","","Water/Eau/Aqua, Cyclopentasiloxane, Dimethicone/Vinyl Dimethicone Crosspolymer, Talc, Mica, Glycerin, Cyclohexasiloxane, Caprylic/Capric Triglyceride, Cetyl Peg/Ppg-10/1 Dimethicone, Trimethylsiloxysilicate, Polyglyceryl-4 Isostearate, Magnesium Stearate, Synthetic Beeswax, Silica, Ethylhexylglycerin, Tocopheryl Acetate, Ascorbic Acid, Retinyl Palmitate, Phenoxyethanol, Rumex Occidentalis Extract, Punica Granatum Fruit Extract, Glycyrrhiza Glabra (Licorice)Root Extract, Triethoxycaprylylsilane, 1,2-Hexanediol, May Contain:Iron Oxides (Ci 77491, Ci 77492, Ci 77499), Titanium Dioxide (Ci 77891)",16,3,1,0.5,"IMAN"
"Wet n Wild Photo Ready Stick Foundation, Sand Beige","CHINA","Isononyl Isononanoate, Dipentaerythrityl Hexa C5-9 Acid Esters, Dipentaerythrityl Hexahydroxystearate/Hexastearate/Hexarosinate, Silica, Ethylhexyl Palmitate, Polyglyceryl-10 Decaisostearate, Polyglyceryl-2 Triisostearate, Polyethylene, Caprylic/Capric Triglyceride, Synthetic Wax, Hydrogenated Microcrystalline Wax, Copernicia Cerifera (Carnauba) Wax/Cire de carnauba, Microcrystalline Wax/Cire microcrystalline, Dimethicone/Vinyl Dimethicone Crosspolymer, Euphorbia Cerifera (Candelilla) Wax/Cire de Candelilla, Hydrogenated Styrene/Methyl Styrene/Indene Copolymer, Triethoxycaprylylsilane, Astrocaryum Murumuru Seed Butter, Phytosteryl Macadamiate, Sorbic Acid, Phenoxyethanol, Helianthus Annuus (Sunflower) Seed Oil, Passiflora Edulis Seed Oil, Tocopherol, Schinziophyton Rautanenii Kernel Oil, Macadamia Integrifolia Seed Oil, Argania Spinosa Kernel Oil, Cocos Nucifera (Coconut) Oil, Glycine Soja (Soybean) Oil, Pentaerythrityl Tetra-di-t-butyl Hydroxyhydrocinnamate, Iron Oxides/CI 77491; CI 77492; CI 77499",6.29,NA,1,1,"Wet n Wild"
"Wet n Wild Cushion Contour--105A Brown","China","Water/Eau, Isododecane, Cyclopentasiloxane, Diphenylsiloxy Phenyl Trimethicone, Dimethicone, Glycerin, Peg-10 Dimethicone, Alumina, Butylene Glycol, Disteardimonium Hectorite, Sodium Chloride, Isoeicosane, Phenoxyethanol, Caprylyl Dimethicone, Chlorphenesin, Caprylyl Glycol, Hexylene Glycol, Ethylhexylglycerin, Triethoxycaprylylsilane, Tocopheryl Acetate, Panthenol, Silica, Mica, Iron Oxides/Ci 77491, Ci 77492, 77499, Titanium Dioxide/Ci 77891",5.99,4.6,20,0.18,"Wet n Wild"
"Milani Prep & Brighten Face Oil Rose","United States","",NA,4.6,49,1,"Milani"
"Asepxia Powder Makeup, Translucent Honey","MEXICO","Talc, Calcium Carbonate, Mineral Oil, Ethylhexyl Methoxycinnamate, Polymethyl Methacrylate, Dimethicone, Salix Alba Bark Extract, Opuntia Ficus Indica Stem Extract, Disiloxane, Fragrance, Salicylic Acid, Cyclopentasiloxane, Glycerin, Water (Aqua), Dimethicone/Vinyl Dimethicone Crosspolymer, Glycolic Acid, Cyclohexasiloxane, Dimethicone PEG-7 Phosphate, Cyclotetrasiloxane, Butylene Glycol, Methylparaben, Propylparaben, Imidazolidinyl Urea, Titanium Dioxide (CI 77891), Iron Oxides (CI 77492, 77491, 77499)",8.29,5,1,0.35,"Asepxia"
"CoverGirl TruBlend Contour Palette, Medium","USA","Ethylhexyl Palmitate, Polyethylene, Methyl Methacrylate Crosspolymer, Mica, Hydrogenated Polyisobutene, Phenyl Trimethicone, Nylon-12, Diisostearyl Malate, Ozokerite, Bis-Diglyceryl Polyacyladipate-2, Silica, Disteardimonium Hectorite, Phenoxyethanol, Caprylyl Glycol, Propylene Carbonate, Zinc PCA, Pentaerythrityl Tetra-Di-T-Butyl Hydroxyhydrocinnamate, Tocopheryl Acetate, Calcium Aluminum Borosilicate May Contain/Peut Contenir: Iron Oxides , Titanium Dioxide",12.99,3.8,156,0.28,"CoverGirl"
"Rimmel Lasting Finish Breathable Foundation, Natural Beige","Monaco","AQUA/WATER/EAU, CYCLOPENTASILOXANE, TALC, ISODODECANE, GLYCERIN, VINYL DIMETHICONE/METHICONE SILSESQUIOXANE CROSSPOLYMER, ETHYLHEXYL METHOXYCINNAMATE, PHENYL TRIMETHICONE, PEG-10 DIMETHICONE, TRIMETHYLSILOXYSILICATE, SODIUM CHLORIDE, AMMONIUM ACRYLATES COPOLYMER, PHENOXYETHANOL, DISTEARDIMONIUM HECTORITE, PENTYLENE GLYCOL, TRIETHOXYCAPRYLYLSILANE, CHLORPHENESIN, PARFUM/FRAGRANCE, ALCOHOL DENAT., ASCORBYL PALMITATE, CITRIC ACID, FRUCTOSE, PROPYLENE CARBONATE, SODIUM HYDROXIDE, TOCOPHERYL ACETATE, UREA, RETINYL PALMITATE, DISODIUM DECETH-6 SULFOSUCCINATE, DISODIUM EDTA, LAURETH-30, ALLANTOIN, MALTOSE, SODIUM LACTATE, SODIUM PCA, TREHALOSE, HEXYL CINNAMAL, SODIUM DEHYDROACETATE, LIMONENE, BUTYLPHENYL METHYLPROPIONAL, BENZYL SALICYLATE, LINALOOL, BHT, GLUCOSE, SODIUM HYALURONATE, GERANIOL, TOCOPHEROL, CITRONELLOL, ALPHA-ISOMETHYL IONONE, TITANIUM DIOXIDE (CI77891), IRON OXIDES (CI 77491, CI 77492, CI 77499)",7.99,5,2,1,"Rimmel"
"Neutrogena Nourishing Longwear Makeup, SPF 20, Natural Beige","","Titanium Dioxide - 2.9 %",15.49,4.2,236,1,"Neutrogena"
"Neutrogena Healthy Skin Compact Makeup SPF 55, Classic Ivory","","Avobenzone - 2.8 %, Homosalate - 8 %, Octisalate - 4 %, Octocrylene - 9 %, Oxybenzone - 4 %",14.99,3.7,3,0.35,"Neutrogena"
"e.l.f. Illuminating Palette","China","",6,3.2,258,0.56,"e.l.f."
"Revlon PhotoReady Color Correcting Pen, For Dullness and Sallowness","United States","Aqua/Water/Eau, Dimethicone, Isododecane, Trisiloxane, Peg/Ppg-18/18 Dimethicone, Boron Nitride, Butylene Glycol, Trimethylsiloxysilicate, Bis-Peg/Ppg-14/14 Dimethicone, Methyl Methacrylate Crosspolymer, Phenyl Trimethicone, Sodium Chloride, Tribehenin, Glycerin, Isodecyl Neopentanoate, Cyclopentasiloxane, Disteardimonium Hectorite, Silica Silylate, Silica, Dimethicone/Bis-Isobutyl Ppg-20 Crosspolymer, Triethoxycaprylylsilane, Methicone, Calcium Aluminum Borosilicate, Propylene Carbonate, Sorbitan Sesquioleate, Tocopheryl Acetate, Hydrogen Dimethicone, Methoxy Amodimethicone/Silsesquioxane Copolymer, Tetrasodium EDTA, Phenoxyethanol, Caprylyl Glycol, 1,2-Hexanediol, Titanium Dioxide (CI 77891), Mica, Ultramarines (CI 77007), Chromium Oxide Greens (CI 77288), Iron Oxides (CI 77491, 77492, 77499)",9.99,4.3,617,0.08,"Revlon"
"Physicians Formula Powder Palette Multi-Colored Face Powder Bronzer","","Talc, Mica, Octyldodecyl Stearoyl Stearate, Ethylhexyl Palmitate, Magnesium Stearate, Caprylyl Glycol, Phenoxyethanol, Lauroyl Lysine, Hexylene Glycol, Tin Oxide. May Contain: Iron Oxides, Titanium Dioxide, Ultramarines",NA,4.9,8,0.3,"Physicians"
"NYX Professional Makeup Wonder Stick, Light","China","Mineral Oil/Paraffinum Liquidum/Huile Minerale, Cetearyl Ethylhexanoate, Ethylhexyl Palmitate, Paraffin, Synthetic Wax, Pentaerythrityl Tetraisostearate, Aluminum Starch Octenylsuccinate, Ozokerite, Glycol Montanate, Euphorbia Cerifera (Candelilla) Wax/Candelilla Cera/Cire De Candelilla, Phenoxyethanol. May Contain/Peut Contenir (+/-): Mica, Titanium Dioxide (CI 77891), Iron Oxides (CI 77491, 77492, 77499)",NA,3.9,430,0.28,"NYX"
"Wet n Wild MegaGlo Highlighting Powder, Awesome Blossom","","Synthetic Fluorphlogopite, Boron Nitride, Dimethicone, Octyldodecyl Stearoyl Stearate, Silica, Trimethylsiloxysilicate, Ethyl Macadamiate, Polysorbate 20, Phytosteryl Macadamiate, Caprylic/Capric Triglyceride, Phenoxyethanol, Sorbitan Stearate, Caprylyl Glycol, Magnesium Aluminum Silicate, Ethylhexylglycerin, Hexylene Glycol, Tin Oxide, Lauroyl Lysine, o-Cymen-5-ol, Polyacrylamide, Water/Eau, Tocopheryl Acetate, C13-14 Isoparaffin, Triethoxycaprylylsilane, Laureth-7, Tocopherol, Iron Oxides/CI 77491, Mica, Red 30/CI 73360, Titanium Dioxide/CI 77891.",5.29,NA,430,1,"Wet n Wild"
"e.l.f. Perfect Finish HD Powder, Clear","China","",6,4.2,137,0.28,"e.l.f."
"Physicians Formula Powder Palette Pressed Powder Beige","Italy","Talc, Mica, Pentaerythrityl Tetraisostearate, Zinc Stearate, Octyldodecyl Stearoyl Stearate, Dimethicone, Silica, Glycerin, Butylene Glycol, Water, Nylon-12, Polysorbate 20, Carbomer, Palmitoyl Pentapeptide-3, Dehydroacetic Acid, Sodium Dehydroacetate, Propylparaben, Butylparaben, May Contain: Iron Oxides, Titanium Dioxide, Ultramarines, Ferric Ferrocyanide, Carmine, Chromium Hydroxide Green, Chromium Oxide Greens, Blue 1 Lake, Red 40 Lake, Yellow 5 Lake, Manganese Violet",NA,4.5,2,0.03,"Physicians"
"theBalm BalmShelter Tinted Moisturizer Light Medium","","Water (Aqua), Cetearyl Alcohol, Isopropyl Myristate, Cetyl Dimethicone, Dimethicone, Hexyl Laurate, Potassium Cetyl Phosphate, Styrene/DVB Crosspolymer, Sorbitan Sesquioleate, Phenoxyethanol, Caprylyl Glycol, Ethylhexylglycerin, Hexylene Glycol, Sodium Dehydroacetate, Titanium Dioxide (CI 77891), Iron Oxides (CI 77491, CI 77492, CI 77499)",25,NA,2,1,"theBalm"
"Almay Healthy Glow Makeup + Gradual Self Tanner, Light/Medium","","Makeup: Octinoxate - 7.0 %, Titanium Dioxide - 7.1 %, Zinc Oxide - 4.2 %",14.99,5,1,1,"Almay"
"e.l.f. Beautifully Bare Sheer Tint Finishing Powder, Light/Medium","China","",NA,4.1,73,0.33,"e.l.f."
"NYX Professional Makeup Shine Killer","Taiwan, Province Of China","Dimethicone, Cyclopentasiloxane, Dimethicone Crosspolymer, Isododecane, Isononyl Isononanoate, Trimethylsiloxysilicate, Silica Dimethyl Silylate, Caprylyl Glycol, Phenoxyethanol",NA,3.6,159,0.67,"NYX"
"CoverGirl TruBlend Face Primer- Oily Skin","USA","Water, Cyclopentasiloxane, Propylene Glycol, Talc, Dimethicone, Aluminum Starch Octenylsuccinate, Sodium Chloride, PEG/PPG-18/18 Dimethicone, PVP, Phenoxyethanol, Titanium Dioxide, Ethylene/Methacrylate Copolymer, Trihydroxystearin, Caprylyl Glycol, 1,2-Hexanediol, Arachidyl Behenate, Sodium Benzoate, Methicone, Silica, Synthetic Wax, Polyglyceryl-4 Isostearate, Hexyl Laurate, Cetyl PEG/PPG-10/1 Dimethicone, Ethylene Brassylate, Behenic Acid, Polyethylene",9.79,4,166,1,"CoverGirl"
"Neutrogena Prep + Correct Brightening Primer","Korea, Republic Of","WATER, METHYL TRIMETHICONE, DIMETHICONE, DICAPRYLYL CARBONATE, BUTYLENE GLYCOL, GLYCERIN, PEG-10 DIMETHICONE, PENTYLENE GLYCOL, POLYMETHYLSILSESQUIOXANE, DIISOSTEARYL MALATE, DISTEARDIMONIUM HECTORITE, LAURYL PEG-9 POLYDIMETHYLSILOXYETHYL DIMETHICONE, DIMETHICONE/VINYL DIMETHICONE CROSSPOLYMER, METHYL METHACRYLATE CROSSPOLYMER, DIMETHICONE CROSSPOLYMER, MAGNESIUM SULFATE, TRIBEHENIN, PHENOXYETHANOL, CAPRYLYL METHICONE, GLYCERYL TRIBEHENATE/ISOSTEARATE/EICOSANDIOATE, ISODODECANE, TRIETHOXYCAPRYLYLSILANE, ETHYLHEXYLGLYCERIN, DISODIUM EDTA, CHONDRUS CRISPUS EXTRACT, CITRIC ACID, TITANIUM DIOXIDE, MAY CONTAIN: CHROMIUM OXIDE GREENS, IRON OXIDES, ULTRAMARINES",14.99,4.5,104,1.05,"Neutrogena"
"Soap & Glory Cheek Stick Love at First Blush","China","Ethylhexyl Palmitate, Mica, Octyldodecanol, Paraffin, Cera Microcristallina (Microcrystalline Wax / Cire Microcristalline), Isostearyl Isostearate, Phenyl Trimethicone, Phenoxyethanol, Caprylyl Glycol, Synthetic Fluorphlogopite, Tin Oxide, CI 77891 (Titanium Dioxide), CI 77491 (Iron Oxides), CI 77499 (Iron Oxides), CI 73360 (Red 30).",12,NA,104,0.5,"Soap"
"Walgreens Beauty Slant Tip Lighted Tweezer","","",8.99,NA,104,1,"Walgreens"
"NYX Professional Makeup High Definition Blush, Amber","Taiwan","Aluminum Starch Octenylsuccinate, Polymethyl Methacrylate, Lauroyl Lysine, Trimethylsiloxyphenyl Dimethicone, Octyldodecyl Stearoyl Stearate, Ethylhexyl Palmitate, Zinc Stearate, Dimethicone Isostearyl Isostearate, Tocopheryl Acetate, Phenoxyethanol, Caprylyl Glycol. May Contain (+/-): Mica, Titanium Dioxide (CI 77891), Iron Oxides (CI 77491, 77492, 77499), Carmine (CI 75470), Red 6 (CI 15850), Red 7 Lake (CI 15850), Red 28 Lake (CI 45410)",NA,4.4,89,0.16,"NYX"
"Maybelline Fit Me Shine-Free + Balance Stick Foundation, Classic Ivory 120","","",8.79,3.9,247,0.32,"Maybelline"
"Jordana SCULPT N GO CREAMY CONTOUR STICK, Medium","","",5.29,NA,247,0.26,"Jordana"
"Maybelline Master Strobing Liquid Illuminating Highlighter, Light/Iridescent","","Aqua (Water), Glycerin, Alcohol Denat., Synthetic Fluorphlogopite, Polyglycerin-3 Crosspolymer, Dimethicone, Acrylamide, Sodium Acryloyldimethyltaurate Copolymer, Phenoxyethanol, Isohexadecane, Caprylyl Glycol, Polysorbate 80, Sorbitan Oleate, Dipropylene Glycol, Tin Oxide, Sodium Citrate, Tocopherol, Isopropyl Alcohol, Citric Acid, May Contain +, -: Mica, CI 77891 (Titanium Dioxide), CI 77491 (Iron Oxides)",9.79,4.4,663,0.21,"Maybelline"
"L'Oreal Paris True Match Super-Blendable Concealer, Medium Deep Warm W6-7-8","USA","Water, Cyclopentasiloxane, Isododecane, Glycerin, Cyclohexasiloxane, PEG 10 Dimethicone, Polymethylmethacrylate, Butylene Glycol, Dimethicone, Isoeicosane, Disteardimonium Hectorite, Cetyl/PEG/PPG 10/1 Dimethicone, C9 15 Fluoroalcohol Phosphate, Sodium Chloride, Phenoxyethanol, Alcohol Denatured, Polyglyceryl 4 Isostearate, Hexyl Laurate, Isostearyl Neopentanoate, Capryl Glycol, Methylparaben, Butylparaben, Tocopherol (Natural Vitamin E), Panthenol, May Contain (+/-):, Iron Oxides (CI 77492, CI 77499, CI 77491), Mica",9.79,4.3,83,0.17,"L'Oreal"
"L'Oreal Paris True Match Lumi Cushion Foundation, C8 Cocoa","","Water, Butylene Glycol, Dicaprylate/Dicaprate, Methyl Trimethicone, Dimethicone, Titanium Dioxide, Diphenylsiloxy Phenyl Trimethicone, Glycerin, Lauryl PEG-9 Polydimethylsiloxyethyl Dimethicone, Pentylene Glycol, Trisiloxane, PEG-10 Dimethicone, Magnesium Sulfate, Acrylates/Stearyl Acrylate/Dimethicone Methacrylate Copolymer, Phenoxyethanol, Dimethicone Crosspolymer, Lauroyl Lysine, Disteardimonium Hectorite, Ethylhexylglycerin, Polyhydroxystearic Acid, Stearic Acid, Alumina, Triethoxycaprylylsilane, Lecithin, Isopropyl Myristate, Isostearic Acid, Ethylhexyl Palmitate, Adenosine, Polyglyceryl-3 Polyricinoleate, Disodium EDTA, Phenylethyl Resorcinol, Tocopherol",16.99,3.6,146,0.51,"L'Oreal"
"L'Oreal Paris True Match Super Blendable Crayon Concealer, Fair/Light Neutral N1-2-3","","",9.99,3.8,116,0.1,"L'Oreal"
"Almay Anti-Aging Skintone Matching Makeup, 400 Medium Meets Deep","United States","Titanium Dioxide - 4.8 % (Sunscreen), Zinc Oxide - 2.4 % (Sunscreen)",13.99,5,2,1,"Almay"
"CoverGirl Ready, Set Gorgeous Concealer, Light 115/120","USA","Water, Cyclopentasiloxane, Propylene Glycol, Dimethicone, Talc, PEG/PPG 18/18 Dimethicone, Aluminum Starch Octenylsuccinate, Sodium Chloride, PVP, Laureth 7, Sodium Dehydroacetate, Trihydroxystearin, Arachidyl Behenate, Methylparaben, Methicone, Propylparaben, Silica, Ethylene/Methacrylate Copolymer, Synthetic Wax, Polyglyceryl 4 Isostearate, Hexyl Laurate, Cetyl PEG/PPG 10/1 Dimethicone, Ethylene Brassylate, Behenic Acid, Polyethylene, Aluminum Hydroxide, Stearic Acid, May Contain:, Titanium Dioxide, Iron Oxides",7.99,3.9,327,0.37,"CoverGirl"
"CoverGirl TruBlend FixStick Concealer, Medium M5-7","USA","Ricinus Communis (Castor) Seed Oil, C12 15 Alkyl Benzoate, Polyethylene, Caprylic/Capric Triglyceride, Ethylhexyl Palmitate, Nylon 12, Cetearyl Ethylhexanoate, Silica, Carthamus Tinctorius (Safflower) Seed Oil, Phenoxyethanol, Tocopheryl Acetate, Cucumis Sativus (Cucumber) Fruit Extract, Butyrospermum Parkii (Shea) Butter, Chamomilla Recutita (Matricaria) Flower Extract, Vitis Vinifera (Grape) Seed Extract, Titanium Dioxide, Mica, Iron Oxides",8.99,3.6,247,0.12,"CoverGirl"
"Physicians Formula Powder Palette Multi-Colored Powder Palette Healthy Glow Bronzer 2718","Italy","Talc, Zea Mays (Corn) Starch, Mica, Pentaerythrityl Tetraisostearate, Octyldodecyl Stearoyl Stearate, Zinc Stearate, Dimethicone, Tocopheryl Acetate, Tetrasodium EDTA, BHT, Methylparaben, Propylparaben, Butylparaben, Sorbic Acid. May Contain: Iron Oxides, Titanium Dioxide, Ultramarines, Red 7 Lake, Red 30 Lake, Yellow 5 Lake, Yellow 6 Lake",NA,5,6,0.3,"Physicians"
"Almay Make Them Jelly Hi-Lite, Unicorn Light","United States","Aqua/Water/Eau, Butylene Glycol, Glycerin, PEG-240/HDI Copolymer Bis-Decyltetradeceth-20 Ether, Synthetic Fluorphlogopite, Acrylates/C10-30 Alkyl Acrylate Crosspolymer, Mica, Potassium Laurate, Silica, Sodium Hydroxide, Tin Oxide, Tocopherol, Ethylparaben, Methylparaben, Phenoxyethanol, May Contain: Blue 1 (CI 42090), Carmine (CI 75470), Red 33 (CI 17200), Titanium Dioxide (CI 77891)",14.99,5,2,0.58,"Almay"
"Neutrogena Healthy Skin Compact Makeup, Natural Ivory","","Avobenzone - 2.8 %, Homosalate - 8 %, Octisalate - 4 %, Octocrylene - 9 %, Oxybenzone - 4 %",14.99,3.6,106,0.35,"Neutrogena"
"NYX Professional Makeup Highlight & Contour Pro Palette","Taiwan","Talc, Polymethyl Methacrylate, Boron Nitride, Aluminum Starch Octenylsuccinate, Lauroyl Lysine, Trimethylsiloxyphenyl Dimethicone, Dimethicone, Octyldodecyl Stearoyl Stearate, Zinc Stearate, Phenoxyethanol, Caprylyl Glycol, Tocopheryl Acetate. May Contain (+/-): Mica, Titanium Dioxide (CI 77891), Iron Oxides (CI 77491, 77492, 77499), Red 6 (CI 15850)",NA,4.5,345,0.72,"NYX"
"CoverGirl TruBlend Liquid Makeup, Toasted Almond D6","USA","Water, Cyclopentasiloxane, Tridecyl Neopentanoate, Propylene Glycol, PEG 10 Dimethicone, PCA Dimethicone, Cyclohexasiloxane, Methyl Methacrylate Crosspolymer, Hydroxyethyl Acrylate/Sodium Acryloyldimethyl Taurate Copolymer, Squalane, Phenoxyethanol, Butylene Glycol Methylparaben, Isopropyl Titanium Triisostearate, Propylparaben, Polysorbate 60, Trisodium EDTA, Sorbitan Isostearate, Titanium Dioxide, Iron Oxides",NA,3.8,1815,1,"CoverGirl"
"CoverGirl Invisible Concealer, Medium 155","USA of US and imported parts.","Water, Mineral Oil (Paraffinum Liquidum), Isopropyl Palmitate, Propylene Glycol, Talc, Stearic Acid, PEG 20 Methyl Glucose Sesquistearate, Methyl Glucose Sesquistearate, Diazolidinyl Urea, Fragrance, Magnesium Aluminium Silicate, Triethanolamine, Trisodium EDTA, Xanthan Gum, Propylparaben, Cetearyl Alcohol, Methylparaben, Titanium Dioxide, Iron Oxides",6.99,3.4,242,0.34,"CoverGirl"
"Revlon ColorStay for Combo/Oily Skin Makeup, Toffee","","Titanium Dioxide - 4.3 %, Zinc Oxide - 2.1 %",13.99,4.1,30,1,"Revlon"
"Neutrogena Hydro Boost Illuminator, Moonstone","United States","CAPRYLIC/CAPRIC TRIGLYCERIDE, TRIETHYLHEXANOIN, POLYGLYCERYL-2 TRIISOSTEARATE, POLYGLYCERYL-3 DIISOSTEARATE, PARAFFIN, DIMETHICONE, MICROCRYSTALLINE WAX, POLYGLYCERYL-2 ISOPALMITATE/SEBACATE, SYNTHETIC SAPPHIRE, VP/HEXADECENE COPOLYMER, DIMETHICONE CROSSPOLYMER, SORBITAN ISOSTEARATE, CAPRYLYL GLYCOL, GLYCERYL CAPRYLATE, HYDROLYZED HYALURONIC ACID, MICA, TITANIUM DIOXIDE, IRON OXIDES, MAY CONTAIN: SILICA",16.99,4.5,93,0.32,"Neutrogena"
"Maybelline SuperStay Full Coverage, Long Lasting Under-Eye Concealer, Light","United States","AQUA/WATER/EAU, CYCLOPENTASILOXANE, HYDROGENATED POLYISOBUTENE, SORBITAN ISOSTEARATE, PROPANEDIOL, PROPYLENE GLYCOL, ALUMINUM STARCH OCTENYLSUCCINATE, TALC, SYNTHETIC FLUORPHLOGOPITE, OZOKERITE, DISTEARDIMONIUM HECTORITE, PHENOXYETHANOL, DISODIUM STEAROYL GLUTAMATE, MAGNESIUM SULFATE, METHYLPARABEN, ACRYLONITRILE/METHYL METHACRYLATE/VINYLIDENE CHLORIDE COPOLYMER, ALUMINUM HYDROXIDE, ETHYLPARABEN, MALTODEXTRIN, TOCOPHEROL, DISODIUM EDTA, ISOBUTANE, CHAMOMILLA RECUTITA FLOWER EXTRACT/MATRICARIA FLOWER EXTRACT, SODIUM HYALURONATE, CENTAUREA CYANUS FLOWER EXTRACT, MAY CONTAIN: CI 77891/TITANIUM DIOXIDE, CI 77491, CI 77492, CI 77499/IRON OXIDES",11.99,4.6,36,0.23,"Maybelline"
"CoverGirl Outlast Active 24 HR Foundation SPF 20, Golden Ivory","United States","Octinoxate - 3 % (Sunscreen)",11.99,4.2,357,1,"CoverGirl"
"Revlon PhotoReady Finisher Translucent","U.S.A.","Mica, Bismuth Oxychloride, Zinc Stearate, Silica, Dimethicone, Nylon-12, Polymethyl Methacrylate, Polyethylene, Octyldodecyl Glycol Grapeseedate, Ethylhexyl Methoxycinnamate, Cyclopentasiloxane, Trimethylsiloloxysilicate, Triethoxycaprylylsilane, Calcium Aluminum Borosilicate, Saccharomyces/Calcium Ferment, Saccharomyces/Zinc Ferment, Saccharomyces/Potassium Ferment, Saccharomyces/Iron Ferment, Saccharomyces/Copper Ferment, Saccharomyces/Magnesium Ferment, Pentaerythrityl Tetraethylhexanoate, Hydrogenated Lecithin, Lauryl Lysine, Dimethiconol, Methoxypropylgluconamide, Magnesium Ascorbyl Phosphate, Tocopheryl Acetate, Hydrolyzed Rice Protein, Lecithin, Camellia Sinensis Leaf Extract, Aloe Barbadensis Leaf Extract, Chamomila Recutita (Matricaria) Flower Extract, Punica Granatum Extract, Macrocystis Pyrifera Extract, Nereocystis Leutkeana Extract, Laminaria Japonica Extract, Prunus Amygdalus Dulcis (Sweet Almond) Seed Extract, Methyl Methacrylate Crosspolymer, Alumina, Phenoxyethanol, Sorbic Acid, Iron Oxides (CI 77491, 77492, 77499), Titanium Dioxide (CI 77891), Bismuth Oxychloride (CI 77163)",13.99,4.1,337,0.25,"Revlon"
"Physicians Formula Touch of Glow Fond Natural Beige","USA","Cyclopentasiloxane, Water, Cyclohexasiloxane, Butylene Glycol, Cetyl PEG, PPG-10, 1 Dimethicone, Mica, Silica, Polyglyceryl-4 Isostearate, Dimethicone, PEG, PEG/PPG 18/18, Stem Extract, Leaf, Tropaeolum Majus Flower, Lactic Acid, PEG 10/15 crosspolymer, Dimethicone-PEG-10, PEG-10 Dimethicone, Glycerin, Calcium Aluminum Borosilicate, Sodium Chloride, Nylon-12, Dimethicone, Polyglycerin-3, Crosspolymer, Hexyl Laurate, Tribehenin, Magnesium Sulfate, Polysorbate 20, Synthetic Fluorphlogopite, Disodium Cocoyl Glutamate, Caprylyl Glycol, Ethylhexylglycerin, Hexylene Glycol, Tocopheryl Acetate, Triethoxycaprylylsilane, Sodium Cocoyl Glutamate, Tetrahexyldecyl Ascorbate, Lauroyl Lysine, Dipropylene Glycol, Sodium Citrate, Tocopherol, Phenoxyethanol, May Contain: Iron Oxides, Titanium Dioxide",14.95,4.5,2,1,"Physicians"
"L'Oreal Paris True Match Gentle Mineral Makeup SPF 19, Classic Tan","United States","Titanium Dioxide - 10.0 %",14.99,4.2,202,0.35,"L'Oreal"
