"Product","Country","Ingredients","Price","Rev_score","Rev_count","Size","Brand"
"Soap & Glory Cheek Stick - Glow All Out Glow All Out","Canada","Polymethylsilsesquioxane, Isononyl Isononanoate, Hydrogenated Polyisobutene, Polyethylene, Dimethicone, Dimethicone / Vinyl Dimethicone Crosspolymer, PCA Dimethicone, Mica, Pentaerythrityl Tetra-Di-T-Butyl Hydroxyhydrocinnamate, Silica, BHT, CI 77891 (Titanium Dioxide), CI 77492 (Iron Oxides), CI 77491 (Iron Oxides), CI 77499 (Iron Oxides)",12,NA,495,0.05,"Soap"
"Black Radiance True Complexion HD Corrector, Peach","CHINA","Water/Eau, Cyclopentasiloxane, Isononyl Isononanoate, Silica, Isododecane, Cetyl Dimethicone, Cetyl Ethylhexanoate, Propylene Glycol, Dextrin Palmitate, Cetyl PEG/PPG-10/1 Dimethicone, Quaternium-90 Bentonite, Hexyl Laurate, Polyglyceryl-4 Isostearate, Sorbitan Sesquioleate, Propanediol, Hydrogenated Coco-glycerides, 1,2-Hexanediol, Hexadecene, Magnesium Aluminum Silicate, Chlorphenesin, Propylene Carbonate, Trihydroxystearin, Vitis Vinifera (Grape) Seed Oil, Ascorbyl Palmitate, Triethoxycaprylylsilane, Alumina, Caprylhydroxamic Acid, Sodium Hyaluronate, Dipotassium Glycyrrhizate, Tocopheryl Acetate, Glycerin, Tocopherol, Butylene Glycol, Glycine Soja (Soybean) Oil, Carbomer, Polysorbate 20, [+/- (MAY CONTAIN/PEUT CONTENIR): Titanium Dioxide/CI 77891, Ultramarines/CI 77007, Iron Oxides/CI 77491, CI 77492, CI 77499]",NA,NA,495,1,"Black"
"Revlon Youth FX Fill + Blur Primer For Face/Neck","USA","Aqua, Water, Eau, Cyclopentasiloxane, Polysilicone-11, Isododecane, Glycerin, Adipic Acid/Neopentyl Glycol Crosspolymer, PEG-9 Polydimethyl Siloxyethyl Dimethicone, Maris Sal, Sea Salt, Sel Marin, Acrylamide/Sodium Acryloyldimethyltaurate Copolymer, Methyl Methacrylate Crosspolymer, Isohexadecane, Laureth-12, Polysorbate 80, Ethylhexylglycerin, Saccharide Isomerate, Sodium Carrageenan, Phenoxyethanol, Caprylyl Glycol, May Contain, [+/-: Mica, Bismuth Oxychloride (CI 77163), Iron Oxides (CI 77491, 77492, 77499)]",19.99,NA,495,0.33,"Revlon"
"Walgreens Men's Slant & Point Tweezer Set","","",5.99,NA,495,1,"Walgreens"
"Rimmel Insta Conceal & Correct Palette, 001 Universal","Germany","Talc, Coco Caprylate, Dimethicone, Diethylhexyl Carbonate, Polyethylene, Cera Alba Beeswax Cire D' Abeille, Polyamide 5, Dimethicone Vinyl Dimethicone Crosspolymer, Pentaerythrityl Adipate Caprate Caprylate Heptanoate , Helianthus Annuus Seed OiI, Aloe Barbadensis Leaf Extract, Triethoxycaprylylsilane, Alumina, Tocopherol, Chamomilla Recutita Flower Extract, Titanium Dioxide, Iron Oxides, Chromium Oxide Greens, Ultramarines, FD&C Blue 1 Aluminum Lake, D&C Black 2",6.49,NA,495,0.25,"Rimmel"
"Revlon Colorstay Full Cover Foundation, Sand Beige","United States","Dimethicone, Isodecyl Neopentanoate, Aqua/Water/Eau, Isododecane, PEG/PPG-19/19 Dimethicone, Trisiloxane, Trimethylsiloxysilicate, C13-16 Isoparaffin, Mica, Adipic Acid/Neopentyl Glycol Crosspolymer, Boron Nitride, Dimethicone/Bis-Isobutyl PPG-20 Crosspolymer, C10-13 Isoparaffin, Alumina, Butylene Glycol, Cymbidium Grandiflorum (Orchid) Flower Extract, Dimethicone/Silsesquioxane Copolymer, Disteardimonium Hectorite, Ethylhexyl Palmitate, Glycerin, Hydrogen Dimethicone, Lactobacillus/Eriodictyon Californicum Ferment Extract, Lilium Candidum Bulb Extract, Malva Sylvestris (Mallow) Extract, Methicone, Polyisobutene, Propylene Carbonate, Salicylic Acid, Serica ((Silk) Soie), Silica Dimethyl Silylate, Silica Silylate, Sodium Acrylates Crosspolymer-2, Sorbitan Sesquioleate, Tetrasodium EDTA, Tocopherol, Triethoxycaprylylsilane, Caprylyl Glycol, Phenoxyethanol, Titanium Dioxide (CI 77891), Titanium Dioxide [nano], 1,2-Hexanediol, Iron Oxides (CI 77491, 77492, 77499)",13.99,NA,495,0.96,"Revlon"
"L'Oreal Paris True Match Lumi Powder Glow Illuminator, Rose N 202","","Talc, Synthetic Fluorphlogopite, Triisostearin, Phenyl Trimethicone, Magnesium Stearate, Calcium Sodium Borosilicate, Caprylyl Glycol, Tin Oxide, Silica, Mica, Titanium Dioxide, Iron Oxides, Ultramarines, Carmine, Blue 1 Lake",12.79,NA,495,0.31,"L'Oreal"
"Maybelline Fit Me Matte + Poreless Pressed Face Powder Makeup, Fair Ivory","United States","TALC, PERLITE, TRIISOSTEARIN, PHENYL TRIMETHICONE, MAGNESIUM STEARATE, CAPRYLYL GLYCOL, +/- MAY CONTAIN / PEUT CONTENIR: CI 77891 / TITANIUM DIOXIDE, CI 77491, CI 77492, CI 77499 / IRON OXIDES",7.49,NA,495,0.29,"Maybelline"
"Maybelline Master Camo Color Correcting Pen, Blue","","",9.99,NA,495,0.05,"Maybelline"
"Soap & Glory One Heck of a Blot Foundation, Fair Enough","","Isododecane, Cyclopentasiloxane, Butylene Glycol, Methyl Perfluorobutyl Ether, Kaolin, Polymethylsilsesquioxane, Aqua (Water/Eau), Silica, Cetyl PEG, PPG-10, 1 Dimethicone, Polysilicone-11, Dimethicone, Disteardimonium Hectorite, Dimethicone, PEG, PEG/PPG 18/18, Lecithin, Magnesium Aluminum Silicate, C18-36 Acid Triglyceride, Phenoxyethanol, Propylene Carbonate, Caprylyl Glycol, Triethoxycaprylylsilane, Decyl Glucoside, Hexylene Glycol, BHT, +, - May Contain: CI 77891, CI 77492 (Iron Oxides), CI 77491 (Iron Oxides), CI 77499 (Iron Oxides)",19,NA,495,1,"Soap"
"L'Oreal Paris True Match Lumi Shimmerista Highlighting Powder, Sunlight","","Silica, Talc, Dimethicone, Calcium Sodium Borosilicate, Calcium Aluminum Borosilicate, Tin Oxide, Mica, CI 77891 / Titanium Dioxide, CI 77491 / Iron Oxides, CI 75470 / Carmine, CI 77510 / Ferric Ferrocyanide",14.99,NA,495,0.28,"L'Oreal"
"theBalm BalmShelter Tinted Moisturizer Medium","","Water (Aqua), Cetearyl Alcohol, Isopropyl Myristate, Cetyl Dimethicone, Dimethicone, Hexyl Laurate, Potassium Cetyl Phosphate, Styrene/DVB Crosspolymer, Sorbitan Sesquioleate, Phenoxyethanol, Caprylyl Glycol, Ethylhexylglycerin, Hexylene Glycol, Sodium Dehydroacetate, Titanium Dioxide (CI 77891), Iron Oxides (CI 77491, CI 77492, CI 77499)",25,NA,495,1,"theBalm"
"CoverGirl Advanced Radiance SPF 10 Advanced Radiance Age-Defying Makeup, Ivory 105","the USA of US and imported parts.","Titanium Dioxide (5%), Octinoxate (2%)",11.49,NA,495,1,"CoverGirl"
"Revlon ColorStay Brow Mousse 1, 402 Soft Brown","Germany","Isododecane, Talc, Synthetic Fluorphlogopite, Hydrogenated Polycyclopentadiene, Dimethicone, Trimethylsiloxysilicate, Cera Alba, Beeswax, Cire D'Abeille, Vp/Hexadecene Copolymer, Oryza Sativa (Rice), Powder, Disteardimonium Hectorite, Octyldodecanol, Nylon-12, Dimethicone/Vinyl Dimethicone Crosspolymer, Polyethylene, Propylene Carbonate, Cera Carnauba, Copernicia Cerifera (Carnauba), Wax, Cire De Carnauba, Tocopherol, Benzoic Acid, May Contain, [+/-: Iron Oxides (CI 77491, CI 77492, CI 77499), Titanium Dioxide (CI 77891)]",10.99,NA,495,0.07,"Revlon"
"Neutrogena Shine Control Powder, Classic Ivory","","Titanium Dioxide 3.2%",14.99,NA,495,0.37,"Neutrogena"
"theBalm BalmShelter Tinted Moisturizer Light","","Water (Aqua), Cetearyl Alcohol, Isopropyl Myristate, Cetyl Dimethicone, Dimethicone, Hexyl Laurate, Potassium Cetyl Phosphate, Styrene/DVB Crosspolymer, Sorbitan Sesquioleate, Phenoxyethanol, Caprylyl Glycol, Ethylhexylglycerin, Hexylene Glycol, Sodium Dehydroacetate, Titanium Dioxide (CI 77891), Iron Oxides (CI 77491, CI 77492, CI 77499)",25,NA,495,1,"theBalm"
"Honest Beauty Everything Primer, Glow","United States","",21.99,NA,495,1,"Honest"
"Physicians Formula Bronze Booster-Highlighter & Contour Palette-Matte Sculpting Palette, 6810","USA","Talc, Mica, Caprylic/Capric Triglyceride, Isostearyl Palmitate, Magnesium Stearate, Synthetic Wax, Silica, Boron Nitride, Dimethicone, Nylon-12, Hdi/Trimethylol Hexyllactone Crosspolymer, Maltodextrin, Polyethylene, Acrylates Copolymer, Mucuna Pruriens Seed Extract, Ptfe, Ascorbyl Palmitate, Inositol, Tocopheryl Acetate, Iron Oxides (Ci 77491, Ci 77492, Ci 77499), Titanium Dioxide (Ci 77891)",15.99,NA,495,0.26,"Physicians"
"Black Radiance Color Perfect Foundation Stick, Bronze Glow","CHINA","Isononyl Isononanoate, Cetearyl Ethylhexanoate, Polyethylene, Cetyl Ethylhexanoate, Dipentaerythrityl Hexa C5-9 Acid Esters, Neopentyl Glycol Diheptanoate, Trioctyldodecyl CitrateMethyl methacrylate Crosspolymer, Methoxy PEG-17/Methoxy PEG-11/HDI Isocyanurate, Trimer Crosspolymer, Silica, Synthetic Candelilla Wax, Hydrogenated Coco-glycerides, Bis-Behenyl/Isostearyl/Phytosteryl Dimer Dilinoleyl Dimer Dilinoleate, Microcrystalline Wax/Cire microcrystalline, Synthetic Wax, Hydrogenated Microcrystalline Wax, Oleic/Linoleic/Linolenic Polyglycerides, Phytosteryl Macadamiate, Phenoxyethanol, Astrocaryum Murumuru Seed Butter, Sorbic Acid, Tocopherol, Glycine Soja (Soybean) Oil, Iron Oxides/CI 77491 CI 77492 CI 77499, Titanium Dioxide/CI 77891",NA,NA,495,1,"Black"
"NYX Professional Makeup Wonder Stick, Deep","China","Mineral Oil/Paraffinum Liquidum/Huile Minerale, Cetearyl Ethylhexanoate, Ethylhexyl Palmitate, Paraffin, Synthetic Wax, Pentaerythrityl Tetraisostearate, Aluminum Starch Octenylsuccinate, Ozokerite, Glycol Montanate, Euphorbia Cerifera (Candelilla) Wax/Candelilla Cera/Cire De Candelilla, Phenoxyethanol. May Contain (+/-): Mica, Titanium Dioxide (CI 77891), Iron Oxides (CI 77491, 77492, 77499)",NA,NA,495,0.28,"NYX"
"CoverGirl TruBlend Matte Made Liquid Makeup, L10 Fair Porcelain","United States","Aqua/Water/Eau, Cyclopentasiloxane, Talc, Propylene Glycol, Dimethicone, PEG/PPG-18/18 Dimethicone, Aluminum Starch Octenylsuccinate, Sodium Chloride, PVP, Phenoxyethanol, Trihydroxystearin, Methicone, Arachidyl Behenate, 1,2-Hexanediol, Caprylyl Glycol, Titanium Dioxide [Nano], Sodium Benzoate, Silica, Acrylonitrile/Methyl Methacrylate/Vinylidene Chloride Copolymer, Synthetic Wax, Polyglyceryl-4 Isostearate, Cetyl PEG/PPG-10/1 Dimethicone, Hexyl Laurate, Ethylene Brassylate, Behenic Acid, Polyethylene, Aluminum Hydroxide, Stearic Acid, Isopropyl Titanium Triisostearate, Titanium Dioxide (CI 77891), Iron Oxides (CI 77491 CI 77492 CI 77499)",NA,NA,495,1,"CoverGirl"
"POP Beauty Makeup Magnet Mist Luminous Effect","Korea, Republic Of","Water/Aqua/Eau, Glycerin, Dipropylene Glycol, Betaine, PEG-60 Hydrogenated Castor Oil, Trideceth-10, Allantoin, Disodium EDTA, 1,2-Hexanediol, Mentha Piperita (Peppermint) Oil, Glycyrrhiza Glabra (Licorice) Root Extract, Caffeine, Aloe Barbadensis Leaf Extract, Cucumis Sativus (Cucumber) Fruit Extract, Ascorbic Acid, Anthemis Nobilis Flower Extract",16,NA,495,0.13,"POP"
"Physicians Formula Mineral Wear Talc-Free All-in-1 ABC Cushion Foundation, Light/Medium","","Titanium Dioxide 8.9%, Zinc Oxide 3.95%",16.95,NA,495,0.47,"Physicians"
"theBalm Even Steven Whipped Foundation Lighter than Light","USA","Isodecane, Cyclopentasiloxane, Polymethylsilsesquioxane, Polysilicone-11, Cetearyl Isononanoate, Dimethicone, Lecithin, Polyhydroxystearic Acid, Zingiber Officinale Root Extract (Ginger), Ethylhexyl Palmitate, Isopropyl Myristate, Isostearic Acid, Polyglyceryl-3 Polyricinoleate, Titanium Dioxide (CI 77891), Iron Oxides (CI 77491, CI 77492)",22,NA,495,1,"theBalm"
"Physicians Formula Argan Wear Ultra-Nourishing Argan Oil Bronzer, Bronzer","Italy","Talc, Mica, Isostearyl Neopentanoate, Fragrance, Polybutene, Argania Spinosa (Argan), Kernel Oil, Ascorbyl Palmitate, C12-15 Alkyl Benzoate, Calcium Sodium Borosilicate, Citric Acid, Glyceryl Oleate, Glyceryl Stearate, Isopropyl Isostearate, Lecithin, Tin Oxide, Tocopherol, Tocopheryl Acetate, Caprylyl Glycol, Hexylene Glycol, Phenoxyethanol, May Contain: Iron Oxides, Titanium Dioxide",14.95,NA,495,0.38,"Physicians"
"Neutrogena SkinClearing SkinClearing Oil-Free Liquid Makeup, Warm Beige","USA","Salicylic Acid (0.5% Acne Treatment)",14.79,NA,495,1,"Neutrogena"
"Sleek MakeUP Lifeproof Concealer, Hot Mocha","","Cyclopentasiloxane, Aqua(Water), Silica, Glycerin, PhenylTrimethicone, Butylene Glycol, PEG-10 Dimethicone, Polypropylsilsesquioxane, Disteardimonium Hectorite, Polymethyl Methacrylate, Dimethicone/Vinyl DimethiconeCrosspolymer, Isododecane, Dimethicone, CetylPEG/PPG-10/1 Dimethicone, Phenoxyethanol, Isostearic Acid, Chlorphenesin, DisodiumStearoyl Glutamate, Hydrogenated Lecithin, SodiumAscorbyl Phosphate, TocopherylAcetate, Aluminum Hydroxide, Sodium Hyaluronate, CI 77492(Iron Oxides), CI 77491(Iron Oxides), CI 77891(Titanium Dioxide), CI 77499(Iron Oxides).",7,NA,495,0.2,"Sleek"
"IMAN Skin Tone Evener BB Cream SPF 15, Clay Medium Deep","China","Ethylhexyl Methoxycinnamate (7.5%), Benzophenone 3 (3%)",20.49,NA,495,1,"IMAN"
"Physicians Formula Bronze Booster Glow-Boosting Season-to-Season Bronzer, Light to Medium","Taiwan","Mica, Diisostearyl Malate, Synthetic Wax, Nylon-12, Ethylhexyl Palmitate, Polybutene, Lauroyl Lysine, Dimethicone, Dimethicone/Methicone Copolymer, Inositol, Maltodextrin, Mucuna Pruriens Seed Extract, Kaolin, Octyldodecyl Stearoyl Stearate, Caprylyl Glycol, Phenethyl Alcohol. May Contains: Iron Oxides, Synthetic Fluorphlogopite, Tin Oxide, Titanium Dioxide, Yellow 5 Lake",15.99,NA,495,0.3,"Physicians"
"CoverGirl Matte Ambition All Day Foundation, Tan Cool 2","United States","Aqua/Water/Eau, Cyclopentasiloxane, Talc, Propylene Glycol, Dimethicone, PEG/PPG-18/18 Dimethicone, Aluminum Starch Octenylsuccinate, Sodium Chloride, PVP, Phenoxyethanol, Methicone, Synthetic Beeswax, Trihydroxystearin, 1,2-Hexanediol, Caprylyl Glycol, Sodium Benzoate, Silica, Acrylonitrile/Methyl Methacrylate/Vinylidene Chloride Copolymer, Synthetic Wax, Polyglyceryl-4 Isostearate, Cetyl PEG/PPG-10/1 Dimethicone, Hexyl Laurate, Ethylene Brassylate, Polyethylene, Aluminum Hydroxide, Stearic Acid, Isopropyl Titanium Triisostearate, May Contain: Titanium Dioxide (CI 77891), Iron Oxides (CI 77491 CI 77492 CI 77499)",NA,NA,495,1,"CoverGirl"
"NYX Professional Makeup Total Control Drop Foundation, Alabaster","CANADA","Cyclopentasiloxane, Water/Aqua/Eau, Glycerin, Vinyl Dimethicone/Methicone Silsesquioxane Crosspolymer, Propylene Glycol, PEG-10 Dimethicone, Isododecane, Dimethicone, Phenyl Trimethicone, Polymethyl Methacrylate, Triethoxycaprylylsilane, Trimethylsiloxysilicate, Propylene Carbonate, Disteardimonium Hectorite, Ethylhexylglycerin, Phenoxyethanol, May Contain: Mica, Titanium Dioxide (CI 77891), Iron Oxides (CI 77491, CI 77492, CI 77499)",NA,NA,495,0.43,"NYX"
"e.l.f. Beautifully Bare Luminous Matte Makeup Primer","China","",8,NA,495,1,"e.l.f."
"Studio 35 Dual-Ended Contouring Brush","","",6.99,NA,495,1,"Studio"
"e.l.f. Mineral Pearls Loose Powder, Natural","China","",NA,3.9,107,0.53,"e.l.f."
"Sleek MakeUP Barekissed Illuminator, Pretty In Paris","China","",11.99,5,3,1,"Sleek"
"Milani Stellar Lights Highlighter Palette Rose Glow","","Mica (CI 77019), Talc, Octyldodecyl Stearoyl Stearate, Pentaerythrityl Tetraisostearate, Dimethicone, Synthetic Fluorphogopite, Phenyl Trimethicone, Silica, Phenoxyethanol, Isododecane, Isohexadecane, Ethylhexylglycerin, Tin Oxide -/+May Contain: Titanium Dioxide (CI 77891), Iron Oxides (CI 77491, CI 77492, CI 77499) Red 40 AL Lake (CI 16035), Manganese Violet (CI 77742), Ultramarines (CI 77007).",NA,4.9,39,0.42,"Milani"
"theBalm Meet Matte Shmaker, Meet Matte Shmaker","","MICA, SYNTHETIC WAX, DIMETHICONE, CAPRYLIC/CAPRIC TRIGLYCERIDE, BORON NITRIDE, PTFE, POLYETHYLENE, KAOLIN, SODIUM DEHYDROACETATE, SILICA, ISOEICOSANE, HYDROGENATED LECITHIN, TIN OXIDE, CALCIUM SODIUM BOROSILICATE, MAY CONTAIN / PEUT CONTENIR [+/- TITANIUM DIOXIDE (CI 77891), BISMUTH OXYCHLORIDE (CI 77163), IRON OXIDES (CI 77491; CI 77492; CI 77499), YELLOW 5 LAKE (CI 19140), CARMINE (CI 75470), CHROMIUM OXIDE GREENS (CI 77288), ULTRAMARINES (CI 77007), BLACK 2 (CI 77266), FERRIC FERROCYANIDE (CI 77510)]",29.5,NA,39,NA,"theBalm"
"Neutrogena Healthy Skin Liquid Makeup, Caramel","","Titanium Dioxide 2.4% (Sunscreen)",14.49,4.1,285,1,"Neutrogena"
"Soap & Glory One Heck of a Blot Foundation, Cool Sand","","Isododecane, Cyclopentasiloxane, Butylene Glycol, Methyl Perfluorobutyl Ether, Kaolin, Polymethylsilsesquioxane, Aqua (Water/Eau), Silica, Cetyl PEG, PPG-10, 1 Dimethicone, Polysilicone-11, Dimethicone, Disteardimonium Hectorite, Dimethicone, PEG, PEG/PPG 18/18, Lecithin, Magnesium Aluminum Silicate, C18-36 Acid Triglyceride, Phenoxyethanol, Propylene Carbonate, Caprylyl Glycol, Triethoxycaprylylsilane, Decyl Glucoside, Hexylene Glycol, BHT, +, - May Contain: CI 77891, CI 77492 (Iron Oxides), CI 77491 (Iron Oxides), CI 77499 (Iron Oxides)",19,3,39,1,"Soap"
"Maybelline SuperStay Full Coverage, Long Lasting Under-Eye Concealer, Ivory","United States","AQUA/WATER/EAU, CYCLOPENTASILOXANE, HYDROGENATED POLYISOBUTENE, SORBITAN ISOSTEARATE, PROPANEDIOL, PROPYLENE GLYCOL, ALUMINUM STARCH OCTENYLSUCCINATE, TALC, SYNTHETIC FLUORPHLOGOPITE, OZOKERITE, DISTEARDIMONIUM HECTORITE, PHENOXYETHANOL, DISODIUM STEAROYL GLUTAMATE, MAGNESIUM SULFATE, METHYLPARABEN, ACRYLONITRILE/METHYL METHACRYLATE/VINYLIDENE CHLORIDE COPOLYMER, ALUMINUM HYDROXIDE, ETHYLPARABEN, MALTODEXTRIN, TOCOPHEROL, DISODIUM EDTA, ISOBUTANE, CHAMOMILLA RECUTITA FLOWER EXTRACT/MATRICARIA FLOWER EXTRACT, SODIUM HYALURONATE, CENTAUREA CYANUS FLOWER EXTRACT, MAY CONTAIN: CI 77891/TITANIUM DIOXIDE, CI 77491, CI 77492, CI 77499/IRON OXIDES",11.99,4.6,36,0.23,"Maybelline"
"theBalm Even Steven Whipped Foundation Light-Medium","USA","Isodecane, Cyclopentasiloxane, Polymethylsilsesquioxane, Polysilicone-11, Cetearyl Isononanoate, Dimethicone, Lecithin, Polyhydroxystearic Acid, Zingiber Officinale Root Extract (Ginger), Ethylhexyl Palmitate, Isopropyl Myristate, Isostearic Acid, Polyglyceryl-3 Polyricinoleate, Titanium Dioxide (CI 77891), Iron Oxides (CI 77491, CI 77492)",22,NA,36,1,"theBalm"
"Physicians Formula Magic Mozaic Pressed Powder, Light Bronzer/Bronzer","","Talc, Synthetic Wax, Isopropyl Lanolate, Aluminum Starch Octenylsuccinate, Cetyl Acetate, Mica, Nylon-12, Lauroyl Lysine, Cyclopentasiloxane, Octyldodecyl Stearoyl Stearate, Acetylated Lanolin Alcohol, BHT, Methylparaben, Propylparaben, May Contain: Iron Oxides, Ultramarines, Manganese Violet, Carmine, Titanium Dioxide, Red 7 Lake, Yellow 5 Lake, Blue 1 Lake",14.99,3.3,9,0.03,"Physicians"
"Black Radiance True Complexion Soft Focus Finishing Powder, Creamy Bronze Finish","China","Talc, Polymethyl Methacrylate, Nylon-12, Zinc Stearate, Boron Nitride, Octyldodecyl Stearoyl Stearate, Isostearyl Neopentanoate, Caprylyl Glycol, Alumina, Caprylhydroxamic Acid, Glycerin, Methicone, Mica, Titanium Dioxide/Ci 77891, Iron Oxides/Ci 77491, Ci 77492",NA,4.9,18,0.45,"Black"
"Black Radiance Color Perfect Oil-Free Liquid Make-up, Mocha Honey","China","Water/Eau, Glyceryl Stearate, Cyclopentasiloxane, Isododecane, Isostearyl Neopentanoate, Caprylic/Capric Triglyceride, Cetyl Peg/Ppg-10/1 Dimethicone, Hexyl Laurate, Polyglyceryl-4 Isostearate, Aluminum Starch Octenylsuccinate, Triethanolamine, Magnesium Aluminum Silicate, Cellulose Gum, Disodium Stearoyl Glutamate, Chlorphenesin, Disteardimonium Hectorite, Aloe Barbadensis Leaf Extract, Chamomilla Recutita (Matricaria) Flower Extract, Acrylates Copolymer, Oenothera Biennis (Evening Primrose) Oil, Methylisothiazolinone, Phospholipids, Disodium Edta, Trisodium Edta, Talc, [+/- (May Contain/Peut Contenir): Chromium Hydroxide Green/Ci 77289, Iron Oxides/Ci 77491, Ci 77492, Ci 77499, Titanium Dioxide/Ci 77891, Ultramarines/Ci 77007]",NA,NA,18,1,"Black"
"Neutrogena Nourishing Longwear Makeup, SPF 20, Buff","","Titanium Dioxide - 2.9 %",15.49,4.2,233,1,"Neutrogena"
"CoverGirl Outlast All Day Primer, Clear","USA","Water, Cyclopentasiloxane, Talc, Propylene Glycol, Dimethicone, Aluminum Starch Octenylsuccinate, PEG/PPG-18/18 Dimethicone, Sodium Chloride, PVP, Caprylyl Glycol, 1,2-Hexanediol, Ethylene/Methacrylate Copolymer, Trihydroxystearin, Methicone, Arachidyl Behenate, Phenoxyethanol, Sodium Benzoate, Silica, Synthetic Wax, Polyglyceryl-4 Isostearate, Hexyl Laurate, Cetyl PEG/PPG-10/1 Dimethicone, Ethylene Brassylate, Behenic Acid, Polyethylene",11.99,4.2,210,1,"CoverGirl"
"IsaDora Under Cover Face Primer","","Water, Dimethicone, Isododecane, Silica, Hdi/Trimethylol Hexyllactone Crosspolymer, Polysilicone-11, Castor Oil Bis-Hydroxypropyl Dimethicone Esters, Coco-Caprylate/Caprate, Nylon-12, Cucumis Sativus (Cucumber) Fruit Extract, Rosmarinus Officinalis (Rosemary) Leaf Water, Phenoxyethanol, Butylene Glycol, Polyglyceryl-4 Isostearate, Cetyl Peg/Ppg-10/1 Dimethicone, Hexyl Laurate, Hexyldecanol, Peg-10 Dimethicone, Isohexadecane, Polysorbate 40, Ammonium Polyacryloyldimethyl Taurate, Ammonium Acryloyldimethyltaurate/Vp Copolymer, Caffeine, Dimethyl Isosorbide, Potassium Sorbate, Glucosamine Hcl, Acetyl Tyrosine, Pisum Sativum (Pea) Extract, Decyl Glucoside, Sodium Hyaluronate, Proline, Bambusa Vulgaris Leaf/Stem Extract, Caprylyl Glycol, Hexylene Glycol, Bisabolol, Adenosine Triphosphate, Hydrolyzed Vegetable Protein, Cetylhydroxyproline Palmitamide, Stearic Acid, Citric Acid, Peg-12 Glyceryl Laurate, Peg-35 Castor Oil, Pvp, Sodium Benzoate, Disodium Carboxyethyl Siliconate, Palmitoyl Hexapeptide-14, Brassica Campestris (Rapeseed) Sterols, Edta, Disodium Edta, Tocopherol, Iron Oxides]",18,4.5,51,NA,"IsaDora"
"Rimmel Insta Conceal & Contour Palette, 020 Medium","Germany","Aqua/Water/Eau, Cera Alba/Beeswax/Cire D'Abeille, Copernicia Cera/Copernicia Cerifera (Carnauba) Wax/Cire De Carnauba, Paraffin, Ammonium Acrylates Copolymer, Polysorbate 20, Nylon-6/12, Candelilla Cera/Euphorbia Cerifera (Candelilla) Wax/Cire De Candelilla, Lithium Magnesium Sodium Silicate, Potassium Cetyl Phosphate, Hydrogenated Palm Glycerides, Cyclopentasiloxane, Stearic Acid, Trimethylsiloxysilicate, Phenoxyethanol, Alcohol Denat, Disodium Deceth-6 Sulfosuccinate, Xanthan Gum, Laureth-30, Argania Spinosa Kernel Oil, Sodium Hydroxide, Disodium EDTA, Ethylhexylglycerin, Acrylates/Carbamate Copolymer, Sodium Dehydroacetate, Collagen, Hydrolyzed Keratin, Sodium Sulfate, Potassium Sorbate, Tocopherol, Sodium Benzoate, [May Contain +/-: Iron Oxides (CI 77491, CI 77492, CI 77499)]",6.49,4.3,9,0.25,"Rimmel"
"Soap & Glory Cheek Stick Wonderbronze","China","Ethylhexyl Palmitate, Mica, Octyldodecanol, Paraffin, Cera Microcristallina (Microcrystalline Wax), Isostearyl Isostearate, Phenyl Trimethicone, Phenoxyethanol, Caprylyl Glycol, Synthetic Fluorphlogopite, Tin Oxide, Alumina, Glycerin, CI 77891 (Titanium Dioxide), CI 77491 (Iron Oxides), CI 77499 (Iron Oxides).",12,NA,9,0.5,"Soap"
"Almay Skin Tone Matching Pressed Powder, Deep Like Me","United States","Talc, Zinc Stearate, C12-15 Alkyl Benzoate, Polyethylene, Adipic Acid/Neopentyl Glycol Crosspolymer, Zea Mays (Corn) Starch, Phenyl Trimethicone, Nylon-12, Kaolin, Synthetic Fluorphlogopite, Methicone, Triethoxycaprylylsilane, Lecithin, Silica, Phenoxyethanol, Ethylhexylglycerin, Iron Oxides (CI 77491, 77492, 77499), Titanium Dioxide (CI 77891) Bound",14.79,NA,9,0.2,"Almay"
"L'Oreal Paris True Match Mineral Gentle Makeup SPF 19, Soft Sable","United States","Titanium Dioxide - 10.0 %",14.99,4.2,202,0.35,"L'Oreal"
"IsaDora Nude Super Fluid Foundation, Nude Sand","","Aqua/Water, Dimethicone, Phenyl Trimethicone, Isododecane, Myristyl Trisiloxane, Vinyl Dimethicone/Methicone Silsesquioxane Crosspolymer, Peg-10 Dimethicone, Talc, Trimethylsiloxysilicate, Cetyl Peg/Ppg-10/1 Dimethicone, Butylene Glycol, Glycerin, Disteardimonium Hectorite, Phenoxyethanol, Sodium Chloride, Alcohol, Caprylic/Capric Triglyceride, Potassium Sorbate, Tocopherol, Carthamus Tinctorius (Safflower) Seed Oil, Mica, Aloe Barbadensis Leaf Extract, Vitis Vinifera (Grape) Fruit Extract, Ci77492/Iron Oxides, Ci77499/Iron Oxides, Ci77891/Titanium Dioxide]",22,5,1,NA,"IsaDora"
"POP Beauty Prismatic Pop, Lit-Up","China","Mica, Magnesium Stearate, Ethylhexyl Palmitate, Nylon-12, Octyldodecanol, Phenoxyethanol, Caprylyl Glycol, +/- Titanium Dioxide (CI 77891), Iron Oxides (CI 77491) (CI 77492) (CI 77499)",12,NA,1,0.18,"POP"
"IsaDora Face Glow Prisma Wheel 50 Rainbow Highlights","","Talc, Mica, Isopropyl Lanolate, Cetyl Acetate, Cyclohexasiloxane, Nylon-12, Lauroyl Lysine, Aluminum Starch Octenylsuccinate, Zinc Stearate, Octyldodecyl Stearoyl Stearate, Paraffinum Liquidum/Mineral Oil, Diisostearyl Malate, Acetylated Lanolin Alcohol, Polyisobutene, Undecylenoyl Glycine, Sodium Dehydroacetate, Capryloyl Glycine, Ozokerite, Dimethicone, Hydrogenated Polydecene, Hydrogenated Styrene/Isoprene Copolymer, Tocopherol, Synthetic Fluorphlogopite, Tin Oxide [+/- Ci77891/Titanium Dioxide, Ci77491/Iron Oxides, Ci77492/Iron Oxides, Ci77499/Iron Oxides, Ci75470/Carmine, Ci77007/Ultramarines, Ci77510/Ferric Ferrocyanide, Ci77288/Chromium Oxide Greens]",25,4.5,50,1,"IsaDora"
"Black Radiance True Complexion Creme Contour Palette, Light To Medium","China","Neopentyl Glycol Diheptanoate, Ethylhexyl Palmitate, Silica, Hydrogenated Polydecene, Ozokerite, Dimethicone, Methyl Methacrylate Crosspolymer, Petrolatum, Hydrogenated Coco-Glycerides, Phenoxyethanol, Lecithin, Sorbic Acid, Propylene Glycol Stearate, Tocopherol, Pentaerythrityl Tetra-Di-T-Butyl Hydroxyhydrocinnamate, Polysorbate 20, Propylene Glycol Laurate, Sorbitan Laurate, Tin Oxide, Iron Oxides/Ci 77491, Mica, Titanium Dioxide/Ci 77891",NA,NA,50,0.26,"Black"
"CoverGirl TruBlend Hyper Glow Highlighter, Pearl Crush","Canada","Mica, Talc, Caprylic/Capric Triglyceride, Dimethicone, Nylon-12, Silica, Magnesium Stearate, Boron Nitride, Paraffin, Isostearyl Alcohol, Methylparaben, Ethylparaben, Sorbitan Isostearate, Tocopheryl Acetate, Tin Oxide, Sodium Dehydroacetate, Cera Microcristallina/Microcrystalline Wax/Cire Microcrystalline, Paraffinum Liquidum/ Mineral Oil/ Huile minerale, Calcium Sodium Borosilicate, Synthetic Fluorphlogopite, Calcium Aluminum Borosilicate, May Contain/Peut Contenir/+/-:Titanium Dioxide (CI 77891), Carmine (CI 75470), Ultramarines (CI 77007), Manganese Violet (CI 77742), Red 6 (CI 15850), Red 7 Lake (CI 15850), Iron Oxides (CI 77491, CI 77492, CI 77499)",10.99,5,1,0.12,"CoverGirl"
